<?xml version="1.0" encoding="UTF-8" standalone="no"?>
<!DOCTYPE holidays SYSTEM "holidays.dtd">
<!-- 
    This file is from the free xml-holidays project. See also
    http://xml-holidays.sourceforge.net/
    Thank you for keeping the comment.
-->
<holidays country="jp">
    <!-- http://en.wikipedia.org/wiki/Holidays_of_Japan 
         http://www.japan-guide.com/e/e2062.html -->

    <holiday name="Ganjitsu" type="national holiday">
        <import name="New Year's Day"/>
    </holiday>
    
    <holiday name="Seijin no hi" type="national holiday"
             international="Coming of Age">
        <!-- This national holiday was established in 1948 -->
        <definition firstyear="1948" lastyear="1999">
            <fixed day="15" month="January"/>
        </definition>
        <!-- Originally held on January 15, in 2000 it was changed to
             the second Monday of January -->
        <definition firstyear="2000">
            <rule nth="2nd" weekday="Monday" month="January"/>
        </definition>
    </holiday>

    <holiday name="setsubun)">
        <definition>
            <fixed day="3" month="February"/>
        </definition>
    </holiday>
    
    <holiday name="Kigen-setsu" valid="false">
        <!-- From 1872 to 1948, February 11 was known as Kigen-setsu -->
        <definition firstyear="1872" lastyear="1948"/>
            <fixed day="11" month="February"/>
        </definition>
    </holiday>
    
    <holiday name="Kenkoku kinen no hi" type="national holiday">
        <!-- This national holiday was established in 1966
             (and first held in 1967) -->
        <definition firstyear="1967">
            <fixed day="11" month="February"/>
        </definition>
    </holiday>
    
    <holiday name="Valentine's Day">
        <import name="Valentine's Day"/>
    </holiday>
    
    <holiday name="hina matsuri" type="national holiday"
             international="Doll's Festival">
        <definition>
            <fixed day="3" month="March"/>
        </definition>
    </holiday>

    <!-- http://www.japan-guide.com/topic/0003.html -->
    <holiday name="hina matsuri" type="national holiday"
             international="White Day">
        <definition>
            <fixed day="14" month="March"/>
        </definition>
    </holiday>


    <!-- Prior to 1948, the vernal equinox was an imperial
         ancestor worship festival called Shunki kōrei-sai -->
<!--    <holiday name="Shunki kōrei-sai">
        <definition lastyear="1947">
             <equinox type="vernal"/>
        </definition>
    </holiday>
-->

    <!-- This national holiday was established in 1948 -->
    <!-- Around March 20 -->
<!--    <holiday name="Shunbun no hi" type="national holiday"
             international="Vernal equinox">
         <definition firstyear="1948">
             <equinox type="vernal"/>
         </definition>
    </holiday>
-->

    <!-- http://en.wikipedia.org/wiki/Sh%C5%8Dwa_Day -->
    <holiday name="Shōwa no hi" type="national holiday"
             international="Shōwa Day">
        <definition firstyear="2007">
            <fixed day="29" month="April"/>
        </definition>
    </holiday>
    
    <!-- http://en.wikipedia.org/wiki/Constitution_Memorial_Day -->
    <holiday name="Kenpō kinenbi" type="national holiday"
             international="Constitution Memorial Day">
        <!-- This national holiday was established in 1948 -->
        <definition firstyear="1948">
            <fixed day="3" month="May"/>
        </definition>
    </holiday>

    <!-- From 1986 to 2006, May 4 was a holiday known as Kokumin no kyūjitsu -->
    <holiday name="Kokumin no kyūjitsu" valid="false">
        <definition firstyear="1986" lastyear="2006"/>
             <fixed day="4" month="May"/>
        </definition>
    </holiday>
    
    <holiday name="Midori no hi" type="national holiday"
             international="Greenery Day">
        <!-- Until 2006, Greenery Day was celebrated on April 29 -->
        <definition lastyear="2006">
             <fixed day="29" month="April"/>
         </definition>
        <!-- in 2007, Greenery Day was moved to May 4 -->
        <definition firstyear="2007">
            <fixed day="4" month="May"/>
        </definition>
    </holiday>

    <holiday name="Kodomo no hi" type="national holiday"
             international="Children's Day">
         <!-- This national holiday was established in 1948 -->
         <definition>
              <fixed day="5" month="May"/>
         </definition>
    </holiday>
    
    <holiday name="Umi no hi" type="national holiday"
             international="Marine Day">
          <!-- This national holiday was established in 1995
               (and first held in 1996) -->
          <defintion firstyear="1996" lastyear="2002">
              <fixed day="20" month="July"/>
          </defintion>
          <!-- Originally held on July 20, in 2003 it was changed to
               the third Monday of July -->
          <definition firstyear="2003">
              <rule nth="3rd" weekday="Monday" month="July"/>
          </definition>
    </holiday>
    

    
    
    <holiday name="Begin Daylight Saving Time (DST)">
        <definition>
            <dst timezone="Asia/Tokyo" action="start"/>
        </definition>
    </holiday>
    
    <holiday name="End Daylight Saving Time (DST)">
        <definition>
            <dst timezone="Asia/Tokyo" action="end"/>
        </definition>
    </holiday>
    
</holidays>
